Title,Price,Subscribers,Reviews,Length,Reviews Percent
Amazon Alexa Development: From Beginner to Intermediate,140,1858,110,2.5,5.920344456404736
The Build a SAAS App with Flask Course,40,2244,365,10.0,16.26559714795009
Learn JSON with JavaScript Objects and APIs in 1 hour,95,3619,93,1.0,2.5697706548770376
1 Hour JavaScript,200,22999,602,1.0,2.617505108917779
Building An E-Commerce Store Using Java Spring Framework,95,2743,589,14.5,21.47283995625228
Typescript Masterclass & FREE E-Book,150,1229,139,7.5,11.310008136696501
PHP MVC Framework CodeIgniter Tutorial for Beginners Project,100,3701,508,10.5,13.726019994596056
JavaScript - Become Higly Paid Front End Developer,105,710,137,3.5,19.295774647887324
Object Oriented Programming (OOP) in PHP - Build An OOP Site,20,6588,721,2.0,10.944140862173649
Beginners Introduction to Web Development,200,7331,55,1.5,0.7502387123175556
Django + AngularJS for a Powerful Web Application,95,4463,59,5.5,1.3219807304503697
WordPress Academy: Learn WordPress step by step,150,1873,360,7.5,19.220501868659902
Web Development Essential Skills - Complete HTML and CSS,95,1388,11,7.0,0.792507204610951
Byte-Sized-Chunks: Closures in Javascript,20,1292,2,2.0,0.15479876160990713
Laravel Account Activation Project,50,1147,19,2.5,1.6564952048823016
WordPress: Create an Amazing Website With Ease,200,1109,13,2.5,1.1722272317403066
Mastering the Google Chrome Developer Tools,20,2002,41,40.0,2.047952047952048
Kali Linux Web App Testing,75,876,48,3.0,5.47945205479452
Learn Ruby Programming The Easy Way - Lite,20,1186,12,34.0,1.0118043844856661
"Web Scraping with Python, Ruby & import. io",75,973,50,4.5,5.138746145940391
Sending email with PHP: from Basic to Advanced,40,379,58,2.0,15.303430079155673
WordPress 2016 for Beginners : Build awesome websites!,20,2177,13,4.0,0.5971520440973818
Learn to make websites with Google's Material Design Lite,20,1063,72,5.5,6.773283160865475
Joomla 3 : Develop a Professional Website in 3 Simple Steps!,35,1309,74,5.0,5.653170359052712
Complete Python Web Course: Build 8 Python Web Apps,110,7489,941,16.0,12.565095473360929
Web Design for Beginners: Real World Coding in HTML & CSS,100,9103,1724,9.0,18.938811380863452
Ethereum Developer: Build A Decentralised Blockchain App,195,3169,527,3.5,16.629851688229724
The Complete Web Development Course -  Build 15 Projects,200,7501,1213,76.5,16.17117717637648
Angular 2 + Rails 5 Bootcamp,150,1967,372,9.0,18.91204880528724
Javascript - From Beginner to Pro-Build real world JS apps,195,28694,688,11.5,2.3977138077646893
Redux in Angular (2 and 4+),70,909,16,1.5,1.76017601760176
The complete JavaScript developer: MEAN stack zero-to-hero,75,4820,983,11.5,20.394190871369293
Running a Web Development Business: The Complete Guide,150,24575,525,19.5,2.136317395727365
Projects In JavaScript & JQuery,60,9109,620,9.0,6.806455154243056
Learn To Build Beautiful HTML5 And CSS3 Websites In 1 Month,50,18818,407,11.0,2.162822829206079
"Full stack Universal React with Redux, Node js and MongoDB",195,1121,174,5.0,15.521855486173058
Creating an MP3 Player with HTML5,20,14551,169,1.5,1.1614322039722356
Be a Bootstrap Developer from scratch,100,5800,185,3.5,3.189655172413793
Create Your First Wordpress Site in Under an Hour,20,4867,128,1.0,2.6299568522703924
Learn Coding as RF or Telecom Engineer - Build Real Program,25,1006,4,2.0,0.3976143141153081
Creating FaceBook Design Using Bootstrap - Handson Project,80,4616,20,2.0,0.43327556325823224
Building HTML5 Canvas projects from scratch,100,8968,35,2.0,0.3902765388046387
Learn How To Become a Web Developer From Scratch,200,7062,72,11.0,1.0195412064570943
"Earn Big Profits With Web Development, Simple and Easy!",90,3073,27,1.5,0.8786202408070289
BDD with Ruby on Rails using RSpec 3 and Capybara,175,2706,179,13.0,6.614929785661492
Learn By Example: jQuery,50,1702,49,7.0,2.8789659224441833
Professional Python Web Development Using Flask,120,3420,489,14.5,14.298245614035087
JavaScript HTML CSS Project make a Quiz Tutorial,95,7130,39,2.0,0.546984572230014
Voiceover Audio Secrets - Your Way to Top Audio Quality,195,918,8,2.5,0.8714596949891068
jQuery UI In Depth,25,1520,21,10.5,1.381578947368421
Codeless Website Development with Adobe Muse,50,461,67,3.5,14.533622559652928
Learn To Build A Google Map App Using Angular 2,30,116,12,1.0,10.344827586206897
Learn Reactivex From Ground Up,40,207,32,5.0,15.458937198067632
Learn HTML in 59 Minutes - Your intro to front-end dev,35,333,15,1.0,4.504504504504505
WordPress Theme Customization 101 (for beginners),40,305,40,2.0,13.114754098360656
Supercharging Development With Atom Text Editor,20,644,42,1.5,6.521739130434782
Master WCF 4.0 From Scratch Using C#,50,415,67,7.0,16.14457831325301
Drupal 7 for Beginners,35,926,102,2.5,11.01511879049676
Critical Web Dev Skills & Tools for the Non-Tech Hustler,Free,3118,8,1.5,0.2565747273893521
Install WordPress on Computer using XAMPP,Free,4290,150,37.0,3.4965034965034967
Java Web Services Part 2,20,959,51,3.0,5.318039624608968
Complete PHP Course With Bootstrap3 CMS System & Admin Panel,195,55332,1225,20.0,2.213908768885997
Learn To Create WordPress Themes By Building 10 Projects,60,2273,384,16.5,16.893972723273208
The Complete NodeJS Course: Build a Full Business Rating App,195,17784,260,12.5,1.461988304093567
Master the MEAN Stack - Learn By Example,195,25799,382,4.5,1.480677545641304
First Web Application with Spring Boot,40,2865,95,4.0,3.315881326352531
HTML5 and CSS3: Learn Web Design with HTML + CSS + Bootstrap,200,346,28,8.5,8.092485549132949
Backbone Tutorial: Learn Backbonejs from Scratch,90,4957,634,5.5,12.789993947952391
AngularJS Custom Directives with Dan Wahlin,75,4128,434,6.0,10.513565891472869
Angular 2+ with Typescript - Essential Training,195,29348,780,3.0,2.6577620280768706
Learn Angular 2 from Beginner to Advanced,195,32696,526,10.0,1.608759481282114
Create an eCommerce Wordpress Website 2016 - New Divi Theme!,30,3503,123,4.0,3.5112760491007706
HTML5 and CSS3 : Landing Pages for Entrepreneurs 2016,195,2354,16,4.0,0.6796941376380629
Learning Docker and Kubernetes by Lab,30,586,54,5.0,9.215017064846416
Projects in ExpressJS - Learn ExpressJs building 10 projects,50,1949,149,15.5,7.644946126218574
PHP For Beginners : Learn PHP From Scratch!,100,1825,17,3.5,0.9315068493150684
Bootstrap 4.0 New Features: Build Responsive Website,40,2296,28,1.5,1.2195121951219512
ASP.NET MVC 5 Project - CMS and Shopping Cart with Paypal,30,550,97,9.0,17.636363636363637
Professional RESTful API Design using Python Flask,120,578,25,4.5,4.325259515570934
HTML5 APIs For JavaScript - A Course For Web Developers ,50,7706,62,5.0,0.8045678691928367
Learn Python Django - A Hands-On Course,50,1339,21,2.0,1.568334578043316
Comprehensive JavaScript Programming,20,6760,84,3.0,1.242603550295858
Security for your WordPress site,85,1096,8,38.0,0.7299270072992701
Try Django 1.9 | Build a Blog and Learn Python's #1 Library,50,7407,172,20.0,2.3221277170244363
Accelerated ES6 JavaScript Training,110,5811,850,6.0,14.627430734813284
AWS Serverless APIs & Apps - A Complete Introduction,145,2145,166,8.0,7.73892773892774
Python and Django Full Stack Web Developer Bootcamp,200,11832,1883,31.5,15.91446923597025
The Complete Elixir and Phoenix Bootcamp,50,5279,1375,14.5,26.04659973479826
Build a Real-world App with ASP.NET Core and Angular 2 (4+),190,5332,828,10.5,15.528882220555138
REST APIs with Flask and Python,110,5151,737,12.5,14.307901378373131
Angular 4 (formerly Angular 2) - The Complete Guide,190,73783,19649,22.0,26.630795711749318
Build Websites from Scratch with HTML & CSS,145,51257,1955,8.0,3.8141131942954134
PHP for Beginners -Become a PHP Master - Project Included,200,28880,4316,30.5,14.944598337950138
The Professional Ruby on Rails Developer,100,17334,676,17.0,3.8998500057690086
The Complete Ruby on Rails Developer Course,195,33677,3809,31.5,11.310389880333759
Docker Technologies for DevOps and Developers,30,19210,3137,3.0,16.330036439354505
JavaScript programming: JavaScript for beginners,55,2215,223,5.0,10.067720090293454
JSON in Action: Build JSON-Based Applications,50,1322,171,3.5,12.934947049924356
Learn Ruby Programming The Easy Way,35,3485,22,2.0,0.6312769010043041
Learn OAuth 2.0 - Get started as an API Security Expert,95,2185,283,3.5,12.951945080091534
AngularJS For .Net Developers From Scratch,50,2494,303,4.5,12.14915797914996
"Jekyll: make fast, secure static sites and blogs with Jekyll",45,2091,86,2.5,4.112864658058346
HTML and CSS BootCamp for Beginners,30,1777,35,6.5,1.9696117051209903
Hosting Django: Amazon Web Services (AWS) Fundamentals,45,2573,103,5.5,4.003109211037699
Angular Advanced MasterClass & FREE E-Book,150,228,9,6.5,3.9473684210526314
Learn Responsive Web Development from Scratch,Free,59639,2692,4.5,4.513824846157716
Build WordPress Plugin to extend Beaver Builder,50,1705,26,2.0,1.5249266862170088
Coding Made Easy: A Beginners Guide To JavaScript,40,1950,33,1.0,1.6923076923076923
The Complete Developers Guide to MongoDB,150,10945,1286,13.5,11.749657377798082
Electron for Desktop Apps: The Complete Developer's Guide,50,2606,241,8.0,9.247889485801995
Vue JS 2 - The Complete Guide (incl. Vue Router & Vuex),190,17671,4675,18.0,26.45577499858525
"React JS, Angular & Vue JS - Quickstart & Comparison",160,2273,288,8.0,12.670479542454904
The Complete JavaScript Course: Build a Real-World Project,195,27801,4340,17.5,15.610949246429984
Angular (Angular 2 or 4) & NodeJS - The MEAN Stack Guide,150,17297,3166,8.5,18.303752095739146
Angular 2 with TypeScript for Beginners: The Pragmatic Guide,150,40070,8341,9.5,20.816071874220114
Meteor and React for Realtime Apps,140,6527,1384,9.0,21.204228588938257
The Web Developer Bootcamp,200,121584,27445,43.0,22.572871430451375
AngularJS JumpStart with Dan Wahlin,75,17802,2144,10.0,12.043590607796876
The Complete Web Developer Course 2.0,200,114512,22412,30.5,19.57174793908062
Ultimate Web Designer & Developer Course: Build 23 Projects!,200,33788,4434,32.5,13.123002249319285
ExpressJS Fundamentals,Free,21245,914,1.0,4.302188750294187
REST WCF Service in ASP.NET,Free,7905,561,41.0,7.096774193548387
Projects in Node.js - Learn by Example,195,869,99,5.0,11.39240506329114
Building Data Visualizations with D3 and Angular 2,125,293,30,3.5,10.238907849829351
Learn Object Oriented PHP By Building a Complete Website,Free,36322,2618,4.5,7.207752877044216
Web Programming Course : Asp.Net MVC,100,2760,76,3.5,2.753623188405797
Learn Spring Framework Practically - Hands On Recipies,145,522,50,5.5,9.578544061302683
One-stop Ruby on Rails: Build Web Applications from Scratch,145,1628,162,18.5,9.950859950859952
Learn what's new in PHP 7,Free,12336,271,3.5,2.1968223086900127
Dive Into Docker: The Docker Course for Developers,Free,6437,313,1.5,4.862513593288799
"Basic Concepts of Web Development, HTTP and Java Servlets",35,2797,59,1.0,2.109402931712549
The Most Comprehensive Web Development Course,200,333,22,42.0,6.606606606606606
Learn and Understand AngularJS,175,59361,11580,7.0,19.5077576186385
JavaScript: Understanding the Weird Parts,175,79612,16976,11.5,21.32341858011355
Webpack 2: The Complete Developer's Guide,75,8964,1893,5.5,21.11780455153949
Build Responsive Real World Websites with HTML5 and CSS3,195,43977,7106,12.0,16.158446460649888
ES6 Javascript: The Complete Developer's Guide,80,13010,2709,6.5,20.822444273635664
Learn and Understand NodeJS,195,58208,11123,13.0,19.109057174271577
Understanding TypeScript,110,9132,1560,7.0,17.082785808147175
Advanced React and Redux,140,21998,3326,12.0,15.119556323302119
Modern React with Redux,180,50815,15117,26.5,29.749089835678443
Angular Styling & Animations (for Angular 2 and Angular 4),120,4138,307,6.0,7.419043015949735
The Complete ASP.NET MVC 5 Course,190,20652,6357,7.5,30.781522370714704
GraphQL with React: The Complete Developers Guide,150,6412,987,13.0,15.393013100436681
"Create a Simple Photo Gallery with Dropzonejs, Slick and PHP",Free,2464,17,44.0,0.689935064935065
WordPress in under an hour - Create/manage your own website!,Free,6474,86,1.0,1.3283904850169912
Twitter Bootstrap 2 for Beginners,20,2388,139,1.0,5.8207705192629815
Bootstrap Tutorial - Essentials From Basic to Advanced,195,1494,23,7.5,1.5394912985274432
Create an Engaging Website with Twitter Bootstrap 2.x,20,1463,56,1.0,3.827751196172249
Javascript :basics for beginners,30,1057,22,37.0,2.081362346263009
CSS Tutorial For Beginners: Style Your Wordpress Templates,35,1049,22,3.5,2.0972354623450906
HTML5 And CSS3 - Build Modern Responsive Websites,175,109,17,9.5,15.59633027522936
PSD to HTML5/CSS3 using Twitter Bootstrap 3! ,95,2073,24,2.0,1.1577424023154848
Web Development: Make A Website That Will Sell For Thousands,50,1116,62,7.5,5.555555555555555
WordPress Basics to Business: Share and Sell your Expertise,50,1125,10,3.5,0.8888888888888888
PHP Zend Framework 2:Creating a CRUD Application,40,802,6,38.0,0.7481296758104738
JavaScript Fundamentals,Free,4409,71,5.0,1.6103424812882738
Building a Website With Jekyll,20,686,19,3.0,2.7696793002915454
Big Data and Apache Hadoop for Developers - Fundamentals,30,1154,89,3.0,7.712305025996534
Wordpress Development : Create a Custom Wordpress Website,120,885,3,1.5,0.3389830508474576
How to Make a Wordpress Website 2017,Free,2437,137,34.0,5.621665982765696
RESTful Services with ASP.NET Web API,85,716,59,2.0,8.240223463687151
Web Hosting Fundamentals,20,1867,19,37.0,1.0176754151044456
Learning Path: React: Make Stunning React Websites,200,91,5,6.5,5.4945054945054945
Administering Microsoft SQL Server 2012 Databases - 70-462,60,586,65,5.5,11.092150170648464
PHP CodeIgniter:CRUD concepts in MVC,40,601,4,35.0,0.6655574043261231
Adobe Experience Manager CMS Basics,35,81,14,1.0,17.28395061728395
Introduction to Frontend Web Development For  Beginners,145,1018,28,4.5,2.75049115913556
PHP: Complete Login and Registration System with PHP & MYSQL,200,1448,173,7.5,11.947513812154696
JavaScript Complete Guide to learning JavaScript,200,1296,22,5.5,1.6975308641975309
Advanced Scalable Python Web Development Using Flask,120,1299,56,14.0,4.311008468052348
jQuery for Absolute Beginners - Lite,20,1769,49,35.0,2.7699265121537593
HTML Complete Course - Beginner to Expert,Free,20073,615,1.5,3.0638170677028844
Cross-Platform Development with ASP.NET Core 1.0 MVC,35,601,126,5.5,20.965058236272878
Build a Photo Blog with Ruby on Rails,20,2281,32,1.5,1.4028934677772906
Practical PHP: Master the Basics and Code Dynamic Websites,Free,83737,4598,6.5,5.491001588306244
Sass Workflow,Free,20890,945,3.0,4.523695548109143
Learn PHP Fundamentals From Scratch,Free,48650,1236,2.0,2.5405960945529293
XML For Absolute Beginners: Learn to create your own tags,75,1945,58,1.0,2.982005141388175
Joomla: Create a Joomla Website This Weekend With NO CODING!,Free,18496,386,2.0,2.086937716262976
JavaScript for beginners - A Complete Guide,100,1193,87,10.5,7.292539815590946
Laravel Deployment - Launch your Laravel Application Online,Free,4905,101,1.0,2.059123343527013
WordPress Development Crash Course: From Zero To Hero,60,1699,8,2.0,0.47086521483225424
Learn how to create a WordPress theme using Pinegrow,Free,11812,152,2.0,1.2868269556383338
Learn to Build Web Apps using Laravel Framework,30,746,93,6.5,12.466487935656836
Flexbox: The complete guide,35,189,7,1.0,3.7037037037037033
How to Safely Copy and Move Your WordPress Website,60,1419,38,1.5,2.6779422128259336
AngularJs :basics for beginners,45,1237,16,1.0,1.2934518997574778
JSON For Beginners: A Very Basic Introduction,65,1703,27,1.0,1.5854374633000587
Learn SASS and improve your CSS,55,1849,29,3.0,1.5684153596538668
Angular Tutorial For Beginners,Free,5397,112,2.5,2.075226977950713
HTML and CSS for Absolute Beginners,Free,4410,52,3.0,1.179138321995465
"JavaScript, jQuery and Ajax",20,1554,30,4.0,1.9305019305019304
Laravel Blog Development Starter,Free,4499,138,2.0,3.067348299622138
React: Learn ReactJS Fundamentals for Front-End Developers,55,1993,55,4.0,2.7596588058203713
JavaScript For Absolute Beginners - Level Two,30,424,85,1.0,20.047169811320757
How To Create A Real Estate Website With Wordpress 2017,Free,3782,32,1.5,0.8461131676361713
The Complete HTML5 and CSS3 Course - with 8 Websites Design,30,1551,42,7.5,2.7079303675048356
Introduction to Modern Programming with PHP,20,954,183,16.0,19.18238993710692
HTML Introduction Course: Learn HTML in 2 hours!!!,Free,7304,368,2.0,5.038335158817087
Learn HTML & CSS: How To Start Your Web Development Career,Free,15462,689,4.5,4.456085887983443
React vs Angular vs Vue.js by Example,Free,6958,132,3.5,1.8970968669157804
Create WordPress Plugins,50,964,19,2.5,1.970954356846473
Build and Deploy a LAMP server on AWS,Free,3571,18,1.0,0.504060487258471
Build your own Beautiful Blog in WordPress + SEO,200,2421,6,3.0,0.24783147459727387
AngularJS Authentication: Secure Your App with Auth0,Free,21689,1080,1.0,4.979482687076398
Learn Bootstrap 4 by Example,Free,5542,54,1.0,0.9743774810537712
Complete WooCommerce Plugin Tutorial For Wordpress 2017,Free,7922,183,1.5,2.310022721534966
How To Build And Make A Wordpress Website From Scratch 2017,Free,7055,166,2.0,2.3529411764705883
Docker for Developers - Newest Version 1.12 with Swarm Mode,95,767,104,5.5,13.559322033898304
Angular Material - Quickstart,Free,3766,135,42.0,3.5847052575677116
HTML and CSS for Beginners - Build a Website & Launch ONLINE,Free,70773,5660,6.0,7.997400138470885
"Core: A Web App Reference Guide for Django, Python, and More",195,2497,98,26.0,3.9247096515818978
"JSON with Java APIs, jQuery and JSON REST Web Services",95,799,87,6.0,10.888610763454318
Bootstrap 4 Quick Start: Code Modern Responsive Websites,Free,41478,2104,3.0,5.072568590578138
Learn Symfony 3 framework by practical examples,125,867,177,4.0,20.415224913494807
"Complete Web Development with HTML, CSS and Javascript",Free,2097,16,2.0,0.7629947544110633
Web Hosting Introduction: How to Publish Your Website Online,Free,5533,137,1.0,2.47605277426351
Django For Beginners,175,534,16,4.0,2.9962546816479403
Introduction to QGIS Python Programming,85,197,26,3.5,13.19796954314721
Learning Object-Oriented JavaScript,75,533,54,3.0,10.131332082551594
Bootstrap Tutorial for Beginners,20,1036,27,2.0,2.606177606177606
Learn Bootstrap3 With Multi Purposes Single Page Layout,Free,4503,146,21.0,3.242282922496114
HTML for Beginners,Free,8592,336,2.5,3.910614525139665
How to Build WordPress Themes: A Web Designer's Guide,165,183,30,5.5,16.39344262295082
XML DTD :basics for beginners,35,903,3,33.0,0.33222591362126247
Learn to make an HTML 5 website with a video background,80,1236,18,30.0,1.4563106796116505
Learn Authentication With ASP.NET Identity Security 2017,50,305,45,2.0,14.754098360655737
HTML and CSS Foundations,Free,1544,15,1.0,0.9715025906735751
Python Web Programming,100,1020,46,6.0,4.509803921568627
Build a Complete Registration and Login System using PHP MVC,80,325,50,5.0,15.384615384615385
ES6 / EcmaScript 6 for beginners an introduction,Free,3227,19,2.0,0.5887821506042764
React for visual learners,20,659,64,3.5,9.711684370257966
Learn to Create Advance Responsive Websites With Bootstrap,20,2528,15,2.0,0.5933544303797469
Master the Art of Web Design with HTML & CSS,145,550,15,3.0,2.727272727272727
Sell Courses On Your Own Website - No Coding Required!,100,1032,9,1.0,0.872093023255814
Implementing a Data Warehouse with SQL Server 2012 ,85,1142,148,5.0,12.95971978984238
Learning 200 jQuery Functions with 800 Examples,195,1766,38,18.5,2.1517553793884483
Create Complete Web Applications easily with APEX 5,30,912,128,7.0,14.035087719298245
"Learn Gulp, The Streaming Build System",25,1305,38,1.5,2.9118773946360155
Perfect React JS Course - Understand Relevant Details,200,653,20,1.0,3.0627871362940278
Create a classified website in 2 hours - guaranteed,50,3411,84,1.0,2.4626209322779244
Learn HTML And CSS From Scratch,Free,11533,240,2.0,2.0809849995664615
Become a Certified Web Developer - Beginner to Expert,200,3397,12,8.0,0.3532528701795702
Complete Bootstrap 4 course - build 3 projects,Free,7865,241,5.0,3.0642085187539734
Up and Running with Phalcon,20,715,12,1.5,1.6783216783216783
HTML : HTML Awesomeness,25,988,23,38.0,2.327935222672065
Build CRUD Application - PHP & Mysql,Free,4405,71,1.5,1.611804767309875
All You Need To Know About AngularJS - Training On AngularJS,50,1936,88,5.0,4.545454545454546
PSD To a Creative Landing Page Using Twitter Bootstrap 3,Free,11666,546,4.0,4.680267443853935
Ready for Production with Spring Boot Actuator,55,361,26,2.5,7.202216066481995
AngularJS For Beginners,Free,30531,1948,3.0,6.38040024892732
Learning Path: Akka: Building Applications and Microservices,200,88,8,4.5,9.090909090909092
Set up a localhost Web Server for Faster Website Development,30,55,13,1.5,23.636363636363637
Mastering Meteor: Reactive Full Stack JavaScript,95,494,46,3.0,9.31174089068826
Build A Professional Wordpress Website In An Hour,20,1294,11,1.0,0.8500772797527048
Build a file hosting/sharing site in less than 2 hours ,20,976,29,1.5,2.971311475409836
Introduction to Java Programming for Online Learners,200,1586,87,22.0,5.485498108448928
Create full featured Landing Page in Ruby on Rails in 3 hour,30,1550,15,3.0,0.967741935483871
How to create a  video blog with WordPress,25,1209,8,4.5,0.6617038875103392
PHP For WordPress Development,35,850,12,1.0,1.411764705882353
Create a Professional Website Without Programming/Coding,Free,5421,93,1.5,1.715550636413946
How to Build an Autocomplete System Like Google,30,255,5,1.0,1.9607843137254901
Master EmberJS : Learn Ember JS From Scratch,120,707,59,6.5,8.345120226308344
How To Make A Modern Wordpress BLOG 2017! Create Your Blog!,Free,6856,137,2.0,1.9982497082847142
Learn Top Ten PHP FrameWorks By Building Projects,60,1007,96,17.5,9.533267130089374
How to Make a Video Blog Website From Scratch w/ Wordpress ,Free,12952,163,1.0,1.2584928968499074
Build Websites And Apps By Outsourcing,20,2299,11,2.0,0.4784688995215311
Learning Path: Web Applications with Spring and Angular,200,19,2,4.0,10.526315789473683
Learn Ruby on Rails By Building Projects,60,1736,79,13.0,4.550691244239631
Canvas image Creator HTML5 JavaScript project from Scratch,100,2195,10,3.5,0.45558086560364464
Javascript Essentials,Free,47062,5590,8.5,11.877948238493902
Devtools 2017: The Basics of Chrome Developer Tools,Free,4569,108,1.0,2.3637557452396587
Chrome Extensions : Develop 5 chrome extensions from scratch,Free,3655,85,2.0,2.3255813953488373
Learn how to quickly build websites using Wordpress,Free,15715,406,3.5,2.5835189309576836
Advance Unix : File Processing: AWK | SED | GREP | CUT | VIM,75,578,40,5.5,6.920415224913495
Develop a Professional OnePage WordPress site With No Coding,20,1747,13,1.5,0.7441327990841442
PHP Specialist (2017 Edition),100,197,11,3.5,5.583756345177665
Python Programming: Create an Digital Marketplace in Django,195,4198,145,26.0,3.454025726536446
Create Ajax Chat App with PHP & Mysql,45,540,11,1.0,2.037037037037037
Mastering Thymeleaf with Spring,75,942,161,4.5,17.091295116772823
Learn Rails Programming in Less than 2 Hours,35,2470,24,2.5,0.9716599190283401
Wordpress Backup & Restore,95,478,37,1.5,7.740585774058577
Learn JavaScript Dynamic Interactive Projects for Beginners,100,2558,12,3.0,0.46911649726348714
Build Modern Websites Super Fast,25,2178,22,1.5,1.0101010101010102
SAP - Learn SAPUI5 Professional Development,195,860,201,7.0,23.372093023255815
Wordpress Security,95,2888,26,2.5,0.9002770083102494
Learn HTML5 At Your Own Pace. Ideal for Beginners,50,3026,60,7.0,1.982815598149372
Build an Amazon clone: Nodejs + MongoDB + Stripe Payment,20,2164,290,8.5,13.401109057301294
Build Real World Websites from Scratch using HTML5 and CSS3,195,10874,114,7.5,1.0483722641162405
How to become an App Developer,200,1935,17,1.0,0.8785529715762275
"Modern JavaScript: Building Real-World, Real-Time Apps",50,1871,154,13.5,8.230892570817744
JavaScript Introduction to Object Oriented JavaScript,90,7789,59,1.5,0.7574784953139042
Core HTML How to get online quickly HTML to HTML5 ,90,10394,33,3.5,0.3174908601116029
Building Websites JavaScript and the DOM,120,17759,64,3.0,0.3603806520637423
Complete Login and Registration System in PHP and MYSQL,200,4714,149,4.0,3.1607976240984303
The Complete E-Commerce Web Developer Course 5.0,195,3209,58,12.5,1.8074166406980368
HTML5 canvas Bootcamp for beginners 25 easy steps,120,14118,30,2.0,0.21249468763280915
Advanced HTML5 Tutorial for Web Developers,50,11847,57,7.5,0.48113446442137253
Learn the Basics of Programming for Marketers,55,11339,43,3.5,0.3792221536290678
Css For Beginners,85,1156,13,2.5,1.124567474048443
GRUNT js: Automate web development tasks and save your time,55,1534,33,1.5,2.1512385919165578
Mastering Web and Mobile Debugging Using Chrome Dev Tools,195,1102,12,2.0,1.0889292196007259
HTML : Beginner Guide to HTML writing,20,783,20,37.0,2.554278416347382
Build Web Apps Using EmberJS: The Complete Course,40,627,126,4.5,20.095693779904305
SharePoint 2013 Development using C# - Part I,50,891,101,8.5,11.335578002244668
SAP Crystal Reports with ASP.Net (Step by step),Free,7484,304,1.0,4.061998931052912
Building Responsive Data Visualizations with D3 JS,85,876,59,2.0,6.735159817351597
Learn Rails Programming in Less than 30 Minute - Lite,20,1235,25,38.0,2.0242914979757085
SASS - Beginner Crash Course,25,1143,34,1.0,2.974628171478565
Angular 2 Fundamentals for Web Developers,40,450,61,6.0,13.555555555555557
Easily Learn Web Development With Drop & Drag: OptimizePress,20,1442,9,2.0,0.624133148404993
XML XSLT - Crash Course for Beginners,45,426,4,1.0,0.9389671361502347
Create Your Own Successful Online School To Sell Courses,95,2814,14,2.0,0.4975124378109453
Flask Tutorial Step by Step,Free,4645,171,2.0,3.681377825618945
Ruby on Rails a Beginners Guide ,Free,13130,346,6.5,2.6351865955826352
Mastering Basic CSS Selectors.,Free,3933,23,3.0,0.5847953216374269
Create a Website Similar to Facebook from Scratch!,25,2197,9,1.5,0.40964952207555755
Comprehensive TypeScript,125,1318,78,4.5,5.918057663125948
