Title,Price,Subscribers,Reviews,Length,Reviews Percent
Introductory JavaScript Made Easy Training Tutorial,20,9381,138,11.0,1.4710585225455708
Become a Heroku Rails Ninja: Expert Level Deployment Tools,50,7090,52,8.5,0.7334273624823695
Complete RESPONSIVE Website Design with HTML5 & CSS3,20,2204,6,9.0,0.27223230490018147
Pimcore Developer: Implement a Blog from a Bootstrap Theme,95,1212,15,4.5,1.2376237623762376
Inspirational Web Development - A Beginner Approach -,20,5328,47,3.5,0.8821321321321322
"Learn HTML, A practical guide from scratch to HTML 5",100,5715,52,3.0,0.9098862642169728
JavaScript Tutorial: Learn JavaScript Code for Beginners,20,2074,14,1.5,0.6750241080038573
Website Secrets: Get a Gorgeous Website on the Cheap,50,12328,15,2.0,0.12167423750811161
Ultimate WordPress Plugin Course,100,4537,415,9.0,9.147013445007714
PHP for Beginners: How to Build an E-Commerce Store,100,5117,463,14.5,9.048270470979089
"Build Realtime Apps | React Js, Golang & RethinkDB",60,3854,482,3.0,12.506486766995328
"Master Electron: Desktop Apps using HTML, JavaScript & CSS",165,1902,224,5.5,11.77707676130389
The Complete Web Developer Masterclass: Beginner To Advanced,195,37141,1813,51.0,4.881397916049648
Mastering Micro Services Using Java Spring Boot,195,1649,34,2.0,2.0618556701030926
How to Create A Website: An HTML Tutorial and CSS Tutorial,65,3012,260,32.5,8.632138114209829
The Advanced Web Developer Course,100,6890,99,10.5,1.4368650217706822
Projects in MongoDB - Learn MongoDB Building Projects,50,4628,247,12.0,5.337078651685393
Learning JavaScript Programming Tutorial. A Definitive Guide,50,17113,380,9.5,2.220534096885409
"The Complete JavaScript, HTML and CSS Tutorial For Beginners",35,244,44,3.0,18.0327868852459
"Build Modern Responsive Website With HTML5, CSS3 & Bootstrap",195,1472,210,13.0,14.266304347826086
The Complete JavaScript Course For Web Development Beginners,195,31499,450,4.0,1.4286167814851265
Email Marketing: Send Unlimited Emails via Own Mail Server,35,3539,43,1.0,1.2150324950551004
Getting started with JavaScript,200,1415,17,1.5,1.2014134275618376
Learn the basics of the Web development: Coding Tactics,40,2965,17,2.0,0.5733558178752108
RESTful API with Laravel 5.4: Definitive Guide,145,655,95,12.5,14.50381679389313
Learn AngularJS Step By Step,20,18777,1112,1.5,5.922138786813655
Learn React : The World's Most Lucrative JavaScript Library,50,1591,99,9.5,6.222501571338781
Master Regular Expressions from scratch - All languages,70,1925,27,2.0,1.4025974025974026
Try AngularJS: Beginner's Guide to Front End Web Development,50,16926,126,4.5,0.7444168734491315
JavaScript Step by Step how to apply it to your web pages,100,13406,78,1.5,0.5818290317768163
Explore JavaScript Beginners Guide to Coding JavaScript,200,5739,26,2.5,0.45304059940756225
Learn Web Scraping with Node.js,75,16731,137,1.0,0.8188392803777419
Getting Started with WordPress 2016,20,1613,21,1.0,1.301921884686919
Learn HTML5 Programming From Scratch,Free,268923,8629,10.5,3.2087251741204734
Getting Started with LESS - Beginner Crash Course,25,1780,69,1.5,3.876404494382023
Master ECMAScript 2015 (ES6),Free,7438,441,2.5,5.929013175584834
Learn to Setup Websites from Scratch,Free,21087,154,3.5,0.7303077725612936
Create Fast RESTful APIs with Lumen and Homestead by Laravel,60,1157,105,3.0,9.075194468452894
"Build Modern Websites Quick With HTML,CSS and Bootstrap",20,912,17,4.5,1.8640350877192982
Twitter Integration customize Tweets with developer API,115,2039,7,1.0,0.34330554193231977
Build a Responsive Website with a Modern Flat Design,Free,16527,354,2.0,2.1419495371210746
The Ultimate WordPress Boot Camp: Build 7 Websites,125,1000,74,11.0,7.3999999999999995
Master the Basics of HTML5 & CSS3: Beginner Web Development,Free,26541,750,3.0,2.8258166610150335
Become A Full Stack Web Developer in 14 Days,195,467,20,13.5,4.282655246252676
Projects In ReactJS - The Complete React Learning Course,50,947,108,8.0,11.40443505807814
Beginning Web development Learn the basics of HTML,95,9832,71,2.0,0.7221318144833198
Step by Step Build Your Template by Bootstrap 4 from scratch,80,2184,15,3.0,0.6868131868131868
Hosting your static website on Amazon AWS S3 service,20,2853,47,1.5,1.6473887136347702
JavaScript Rockstar How to create Incredible Useful code,75,16590,51,2.5,0.3074141048824593
Spring Core DevOps on AWS,100,1626,115,6.5,7.072570725707257
How to Create a Website Without Coding - WordPress 2016,195,9056,96,1.5,1.0600706713780919
PHP Graphic Techniques: CAPTCHA/ Create a verification code,20,8320,73,43.0,0.8774038461538461
Introductory To HTML and CSS,50,4106,112,1.0,2.7277155382367266
Learn how to convert PSD to HTML and CSS responsive,30,5324,52,2.5,0.9767092411720512
PHP User Login Registration Script With All Features,200,5603,46,4.0,0.8209887560235588
AJAX : Let's build a COOL project,70,4183,292,3.5,6.980635907243606
Advanced WordPress Topics: Post Types Taxonomies & Metaboxes,95,301,44,7.5,14.61794019933555
Laravel Homestead,Free,3883,110,1.0,2.8328611898017
The Complete TypeScript Programming Guide for Web Developers,40,236,31,4.0,13.135593220338984
JavaScript with BackboneJS and Bootstrap CSS - Advanced,25,1758,37,3.5,2.1046643913538112
Ruby on Rails Tutorial: Learn 6 Ruby on Rails SEO Techniques,200,1266,16,2.0,1.263823064770932
XML DOM :basics for beginners,35,920,1,42.0,0.10869565217391304
Learn HTML Basics From Scratch,Free,5004,52,3.0,1.0391686650679457
Byte-Sized-Chunks: Dynamic Prototypes in Javascript,20,880,6,3.0,0.6818181818181818
Build Websites from Scratch with Squarespace,50,342,53,3.5,15.497076023391813
Introduction to web programming for GIS applications,100,205,38,13.5,18.536585365853657
Java Spring Security,40,527,63,2.5,11.954459203036052
Responsive Html5 Theme Development,20,1517,4,1.0,0.26367831245880025
What’s New in Bootstrap 4,20,130,14,37.0,10.76923076923077
ReactJS Course: Learn JavaScript Library Used by Facebook&IG,50,1018,33,3.0,3.2416502946954813
Building a Ruby on Rails Application with Neo4j,Free,4830,38,32.0,0.7867494824016562
Sara Learns to Code.  Making an App from Scratch,60,402,20,4.0,4.975124378109453
Ajax  for Beginners: A Very Basic Introduction,65,755,5,2.0,0.6622516556291391
Wordpress Essentials: Useful Plugins,25,1087,7,1.0,0.6439742410303588
Django by Example,125,170,21,9.0,12.352941176470589
Build A Great Wordpress Website For Your Business in 2 Hours,35,1054,4,2.0,0.3795066413662239
Wordpress on AWS: The Easy way to AWS for Free Fast hosting ,40,245,23,1.0,9.387755102040817
Mastering TypeScript,95,353,34,3.0,9.631728045325778
Mastering AngularJS UI Development,95,464,26,1.5,5.603448275862069
Custom Theme Creation for WordPress using HTML5 and CSS3,35,298,20,1.5,6.7114093959731544
Create a PHP Contact Form in Bootstrap,20,2238,65,1.0,2.9043789097408403
Introduction To Data Analytics Using Microsoft Power BI,45,1764,33,1.5,1.870748299319728
HTML Made Simple For Beginners: Create a One Page Website,65,3380,50,2.0,1.4792899408284024
The Complete Web Developer Masterclass: Beginner To Advanced,20,1030,11,2.5,1.0679611650485437
Website Builder Software Previews,25,1406,12,1.0,0.8534850640113799
Learn How to Create Your Own Social Network,50,4732,5,2.0,0.10566356720202875
"Learn By Example: The Foundations of HTML, CSS & Javascript",50,1724,72,13.0,4.176334106728538
JavaScript manipulation of the DOM Document Object Model,20,1618,46,1.5,2.843016069221261
Create Jekyll blog and host it on Github like a Ninja,20,5056,74,2.0,1.4636075949367089
Learn React JS from scratch,115,1562,42,4.0,2.6888604353393086
Web Security: Common Vulnerabilities And Their Mitigation,50,1547,30,8.0,1.9392372333548804
PHP for Beginners,40,2626,95,6.0,3.6176694592536176
Make a professional website - 30 Day Guarantee. Discounted!,20,11167,34,2.0,0.30446852332766183
Symfony 3: Build a PHP Application with Symfony,20,466,11,2.0,2.3605150214592276
Learn ASP.Net Web API 2 for Absolute Beginner,30,1355,14,3.5,1.033210332103321
Build a Website in 30 Minutes,95,5065,40,32.0,0.7897334649555774
Google Blogger : How to Create a Blog,20,1763,17,2.0,0.9642654566080544
How to Make a Website Without Coding- WordPress & Web Skills,30,6413,107,9.0,1.6684858880399187
Learn WCF And Web APIs From Scratch,50,5398,358,10.5,6.632085957762134
How To Build A Website From Scratch + Blogging Blueprint,20,7017,37,3.5,0.5272908650420407
Learn To Create Different Website Layouts & Media Queries ,195,6510,45,2.0,0.6912442396313364
Build Sign Up and Login Forms With Bootstrap Modal,20,1898,19,4.0,1.0010537407797682
"Build a Real Time web app in node.js , Angular.js, mongoDB",20,3299,166,4.0,5.031827826614125
Superb jQuery Course - Become Certified jQuery Developer,95,817,6,1.5,0.7343941248470013
How To Build A Facebook Messenger Chat Bot From Scratch,120,1798,20,1.5,1.1123470522803114
"Build Your Own Calculator App with Javascript, HTML5 & CSS",50,3688,49,1.0,1.3286334056399132
The Complete WordPress Development & Customization Course,100,1611,165,12.5,10.242085661080075
HTML CSS Easy steps to create a web template from scratch,200,11574,78,1.0,0.673924313115604
Learn jQuery AJAX in 1 hour,195,2547,62,1.0,2.434236356497841
Develop Competitive Plugins for WordPress and WooCommerce,150,2063,18,1.0,0.872515753756665
Get Results - Core Principles of Web Development Tricks Tips,75,22355,54,1.5,0.24155669872511742
JSON Faster Sleeker & Easier Discover the benefits learn it,200,8577,69,1.5,0.8044770898915705
Get to know HTML Learn HTML Basics,200,10674,102,2.0,0.9555930297920181
Ultimate Css & JQuery Form Designing From Beginner to Expert,115,783,5,1.0,0.6385696040868455
PHP: Complete Registration and Login with Email Verification,20,12781,145,2.5,1.134496518269306
JavaScript from Beginner to Expert,125,5484,439,12.5,8.00510576221736
Build a website HTML5 CSS3 Beginner Course,150,7884,44,2.0,0.5580923389142567
Learn Ruby on Rails: Stripe Payment Processing,40,15724,33,1.5,0.20987026201984227
WordPress For Beginners | No Coding Required,20,3106,31,1.0,0.9980682549903412
jQuery For Beginners : A Basic Introduction,65,6293,165,1.0,2.6219609089464484
WordPress Plugins and Widgets,40,8711,29,1.0,0.3329124095970612
PHP Essential How to create build Amazing websites with PHP,75,8067,30,3.5,0.3718854592785422
HTML CSS JavaScript: Most popular ways to code HTML CSS JS,170,9332,172,3.5,1.8431204457779682
Bootstrap 3 Beginners: Create a Professional Landing Page,20,3271,278,2.5,8.498929990828492
Introduction to Node.js for Beginners,125,1367,17,6.0,1.2435991221653255
Introduction to Coding with Ruby,45,5077,126,3.5,2.4817805790821352
Complete PHP and MySql Course: From Beginner to Professional,200,6508,137,6.5,2.105101413644745
Angular JS Essentials,195,4687,99,4.0,2.11222530403243
How To Setup Web Hosting,Free,11758,242,1.0,2.0581731587004595
"Web Application Development using Redis, Express, and Socket",200,300,16,6.0,5.333333333333334
How to Start a WordPress Blog - Complete Beginners Guide!,Free,3784,85,2.0,2.2463002114164907
CSS3 Gradients for Web Designers,20,1209,9,1.5,0.7444168734491315
Learn ASP NET MVC 5 step by step,20,1428,91,3.0,6.372549019607843
Tumult Hype Pro Basics: HTML5 Animations Made Easier,50,716,32,4.0,4.4692737430167595
Web Hosting Set Up and WordPress Installation For Beginners,Free,12563,239,34.0,1.9024118443047042
Ruby on Rails 4---A Test-Driven Approach,100,1518,55,19.0,3.6231884057971016
AJAX :basics for beginners,35,1241,23,34.0,1.8533440773569703
Let's JavaScript!  Code a calculator,35,380,10,2.0,2.631578947368421
JavaScript from Beginner to Advanced,195,395,18,17.0,4.556962025316456
WordPress Theme Academy with Bootstrap,20,1169,110,7.5,9.409751924721984
Building a eCommerce Startup in 4 Hours [Livestream],50,1114,8,3.0,0.718132854578097
Responsive PHP Registration Form: From Scratch,95,5738,9,4.0,0.15684907633321715
A-Frame WebVR Programming Tutorial Series (Virtual Reality),40,6648,16,1.5,0.24067388688327318
Learn Bootstrap And Make Responsive Websites,25,1605,10,3.5,0.6230529595015576
HTML Web Development Crash Course,20,4848,33,1.5,0.6806930693069307
Bootstrap Basics: Program Responsive Websites,75,4743,393,3.0,8.285895003162555
Projects with JSON and APIs,20,1520,34,2.0,2.236842105263158
Web Design HTML CSS How to Create a Website from Scratch,50,3601,28,2.0,0.7775617883921133
"Create Complete Sign up System using PHP, jQuery and Ajax",200,4033,40,3.0,0.9918175055789735
Adobe Flash for Beginners - Build Flash Website From Scratch,200,17071,17,1.5,0.09958408997715425
Learn Complete WordPress for Building a Professional Sites,80,13708,92,9.0,0.6711409395973155
Devtools 2017: Beginner to Expert w/ Chrome Developer Tools,125,430,54,2.5,12.558139534883722
Bootstrap Essential Training - Create Your Very Own Website,20,2643,34,9.0,1.2864169504351117
Angular 2 Jump Start With Typescript,20,1731,90,4.0,5.1993067590987865
Learn Plugin Development in WordPress By Building  Projects,60,1313,121,11.0,9.215536938309215
"Build Your Startup with No Coding (Design, Develop & Ship)",30,775,245,8.0,31.61290322580645
The Web Developers Guide: Learn HTML & CSS Fundamentals,20,2243,27,7.0,1.2037449843958983
Learn PHP Programming for Absolute Beginners - Lite,20,2749,62,41.0,2.2553655874863585
Learn Drupal 8 - With a Live Project,55,2012,15,3.5,0.7455268389662028
Supreme NodeJS Course - For Beginners,200,1080,37,3.5,3.425925925925926
CSS3 for beginners,195,3831,15,1.5,0.39154267815191857
Javascript for beginners,75,2071,57,1.5,2.7522935779816518
Become a Bootstrap Expert: Build 20 Layouts!,35,2755,57,17.5,2.0689655172413794
PHP : Learn to upload files to Amazon S3 and use CloudFront,50,1216,36,3.0,2.9605263157894735
PHP MySQL: Learn PHP MySQL with Project,20,2314,77,2.0,3.327571305099395
How to Set Up a Self-Hosted Wordpress Website in 30 Minutes,Free,8770,261,32.0,2.976054732041049
Projects in Django and Python,60,1764,53,6.5,3.00453514739229
"Create, Update and Manage Your Own Website Using Drupal 7",120,2837,68,7.0,2.396898131829397
Learn HTML - The programming language to build a webpage!,25,1655,39,1.0,2.3564954682779455
Learn To Program JavaScript (in ten easy steps),75,2721,96,5.5,3.528114663726571
Bootstrap :basics for beginners,40,1152,20,1.0,1.7361111111111112
Introduction to CSS Development,Free,15493,415,2.0,2.6786290582843866
PHP :basics for beginners,45,1562,4,1.5,0.2560819462227913
Beginning Oracle WebLogic for Administrators,Free,9786,989,42.0,10.106274269364398
Build an HTML5 and CSS3 Website in 35 Minutes,20,1904,25,42.0,1.3130252100840336
Angular 2 Routing: Up And Running,Free,3357,84,37.0,2.5022341376228776
Advanced Prezi: Make Amazing Presentations ,30,2200,25,1.0,1.1363636363636365
1 hour jQuery,100,5456,133,1.0,2.437683284457478
The WpFASTER WordPress Speed Optimization Master Course,175,2134,215,7.0,10.074976569821931
How to Build Your Own Website with WordPress: A Step-by-Step Guide ,95,4675,15,6.0,0.32085561497326204
Build Apps with ReactJS: The Complete Course,40,1433,145,5.5,10.118632240055828
Learn SASS: from beginner to expert,20,1734,9,1.0,0.5190311418685121
The complete HTML5 course,20,3461,11,1.5,0.31782721756717713
Create a Responsive Website with Bootstrap 3,50,4076,39,3.0,0.9568204121687929
Lerning PHP by building website,185,567,63,8.0,11.11111111111111
Learn PHP Object Oriented Features with Simple Examples,20,1723,28,1.0,1.625072547881602
Crash Course - Learn to Create a PHP MVC Framework,50,1282,117,1.0,9.126365054602184
JSON :basics for beginners,45,2052,18,33.0,0.8771929824561403
CSSCasts; CSS libraries Plugins Tips & Tricks for Developers,200,1874,40,44.5,2.134471718249733
Complete Guide to Front-End Web Development and Design,200,1119,111,16.5,9.919571045576408
"Build Ajax Web Apps with Laravel 5.2, Bootstrap and jQuery",100,1023,131,5.0,12.805474095796676
Javascript for Beginners,20,3697,195,3.0,5.274546929943197
MongooseJS Essentials - Learn MongoDB for Node.js,Free,21682,1106,44.0,5.1010054423023705
Regular Expressions for Beginners - Universal,100,1975,141,3.0,7.139240506329115
Learn Redis from Scratch,40,553,84,3.0,15.18987341772152
WordPress Plugin Development -> Deep dive discovery!,40,2650,19,2.0,0.7169811320754716
Learn Ajax and jquery with PHP,20,2964,8,1.5,0.2699055330634278
Create a business website with WordPress,50,1624,31,4.0,1.9088669950738917
DesktopServer : Install WordPress Locally  - Work Anywhere!,65,1640,22,2.0,1.3414634146341464
Understand PHP Arrays and HTTP Request in a Better Way,35,1627,38,35.0,2.3355869698832206
Mastering CSS,95,1815,249,5.0,13.71900826446281
The Complete Wordpress Theme Development Guide,25,1011,2,2.0,0.19782393669634024
The Complete HMTL5 Course - Go From Beginner To Advanced!,95,2430,15,2.0,0.6172839506172839
Learn Jquery from Scratch 2-Hour Training ,20,5318,56,1.5,1.0530274539300488
How to Create a Wordpress Website from Scratch - No Coding,20,7018,28,3.0,0.39897406668566543
Learn PHP CodeIgniter Framework with AJAX and Bootstrap,75,1634,52,2.5,3.182374541003672
The Complete Guide to JavaScript Development,110,3590,36,14.0,1.0027855153203342
Basic HTML CSS and Web Design,30,4030,92,9.0,2.28287841191067
Build Professional WordPress Website,145,4020,95,3.5,2.36318407960199
Ultimate CSS3 Course - From Beginners To Professional,95,2635,25,2.0,0.9487666034155597
Code & Grow Rich:  Earn More As An Entrepreneur Or Developer,200,7211,52,57.0,0.7211205103314381
Learn by Example : ReactJS,50,1496,37,7.5,2.473262032085562
React.js Quickly: Developing Scalable Web User Interfaces,50,4447,76,4.0,1.70901731504385
JavaScript - Tricks and Workarounds,100,1410,134,5.0,9.50354609929078
Kids Coding - Beginner HTML,20,6628,53,1.0,0.7996378998189498
Learn PHP from scratch!!,25,1908,12,1.5,0.628930817610063
PHP with PDO - ULTIMATE Crash Course,50,1248,171,1.5,13.701923076923078
JavaScript for beginners with live examples,195,4587,46,4.0,1.0028340963592761
Bootstrap 3 Introduction : Create RESPONSIVE Websites Fast,50,2351,302,2.5,12.84559761803488
Laravel(5.2) PHP Framework  Jump Start for beginners,20,3898,95,3.0,2.4371472550025657
Professional WordPress Theme Development For 2017,20,3185,102,8.0,3.2025117739403455
Learn Laravel PHP Framework Building Multi User SEO Blog APP,100,557,92,9.5,16.517055655296232
Javascript Specialist,200,408,39,8.0,9.558823529411764
Write PHP Like a Pro: Build a PHP MVC Framework From Scratch,70,1703,435,3.0,25.54315913094539
JavaScript Intro to learning JavaScript web programming,20,17554,94,1.5,0.5354904864988037
Crash Course: Fundamentals Of HTML & CSS From Scratch.,20,7368,216,2.0,2.9315960912052117
"Laravel, the complete guide with real world projects",200,676,119,14.0,17.60355029585799
VueJS V1 Introduction to VueJS JavaScript Framework,200,3632,28,2.0,0.7709251101321586
HTML CSS: Essential steps to learn HTML CSS,145,10576,154,2.5,1.4561270801815431
Learn HTML 5 in 1 hour,100,11643,169,1.0,1.4515159323198488
Learn Html5 & CSS3 from scratch,20,13960,239,2.5,1.7120343839541547
Responsive Web Design: Made Easy,195,5085,106,6.5,2.084562438544739
Parse Server: From Front End to Full Stack,200,1130,162,6.0,14.33628318584071
Codeigniter: How to use Codeigniter that drives knowledge,150,14606,235,3.0,1.6089278378748457
jQuery for Beginners - Create Website Animations Easily,100,2971,285,3.0,9.592729720632784
How to Build Chat Bots: From Beginner to Intermediate,140,2814,107,2.0,3.802416488983653
Web Development with BootStrap - 16 Instant Themes Included!,40,1355,45,3.5,3.3210332103321036
Install a Wordpress Theme the Correct Way & Charge Others,20,2335,13,1.0,0.556745182012848
Coding for Entrepreneurs Basic,Free,161029,279,3.5,0.1732607170137056
The CSS and CSS3 Crash Course,150,2051,99,13.0,4.826913700633837
Build a Business or Personal Website Using Wordpress,200,1069,12,4.5,1.1225444340505144
Learn By Example: PHP For Dynamic Websites,50,1439,10,13.0,0.6949270326615705
Learn ReactJS: Code Like A Facebook Developer,20,1948,72,5.0,3.696098562628337
Learn to Build Web Apps using D3JS,40,841,99,3.5,11.771700356718192
How to create awesome website and e-commerce in 1 hour,20,937,4,1.0,0.42689434364994666
Joomla for Beginners - Learn how to build a website with CMS,95,583,7,3.5,1.2006861063464835
Learning Drupal 8,50,577,97,9.5,16.81109185441941
Learn How To Build a Web Application Without Coding,Free,9364,311,32.0,3.32123024348569
Rock Solid Wordpress Security - Secure Web Development,Free,5052,92,1.5,1.8210609659540775
Mastering JavaScript,95,694,39,4.0,5.619596541786744
PHP Laravel 5:Creating a CRUD application,45,511,12,33.0,2.3483365949119372
XQUERY :basics for beginners,40,937,2,38.0,0.21344717182497333
PHP Development with the Laravel Framework,50,1611,24,3.5,1.48975791433892
WordPress Development - Themes and Plugins Complete Guide,200,103,11,5.5,10.679611650485436
Basic JavaScript: Build 4 Basic JavaScript Projects,40,670,33,4.5,4.925373134328359
HTML and CSS for Beginning Web Developers,100,1606,28,9.0,1.7434620174346203
Popular JavaScript Framework:Learn The Language Of Angular 2,200,260,22,11.0,8.461538461538462
The Ultimate Guide to the Best WordPress Plugins Part 1,50,122,10,10.5,8.19672131147541
XSLT :basics for beginners,35,877,6,32.0,0.6841505131128849
The Complete Wordpress Plugin Development Course - 8 Plugins,200,1215,58,2.5,4.77366255144033
JSON Crash Course for Beginners,45,3323,90,38.0,2.708396027685826
You can create Incredible Websites with HTML CSS learn how,100,11892,50,2.5,0.4204507231752439
JavaScript Tricks how to create code projects from scratch,75,15106,31,1.5,0.20521647027671122
The Sass Course! Learn Sass for Real-World Websites,95,975,141,3.5,14.461538461538462
Web Design How to Create a Website HTML CSS Bootstrap,75,5263,29,2.0,0.5510165304959149
Master Angular 4 by Example - Build 7 Awesome Apps!,195,596,32,8.0,5.369127516778524
Create A Custom Responsive WordPress Website For A Client,95,7517,89,4.5,1.1839829719302915
Mastering HTML5 Programming - The Easier Way,75,21653,138,7.0,0.6373250819747841
How to Launch Your Own Website Builder Service,20,9028,87,1.5,0.9636685866194064
Getting Started with HTML,40,7375,52,1.5,0.7050847457627119
Spring Framework 4 (Java Enterprise JEE) with AngularJS,95,5177,318,13.5,6.142553602472475
Build A Weather App With Ajax Using Open Weather Map API,20,6548,44,4.0,0.6719609040928528
Essentials of JavaScript Practice Coding Exercises Tips,80,28125,115,2.0,0.4088888888888889
Learn and Earn with HTML & CSS,20,9349,206,4.0,2.2034442186330088
Get started Creating Websites Everything you need provided,100,14260,44,3.0,0.3085553997194951
JavaScript in Action JavaScript Projects,150,7720,58,1.5,0.7512953367875648
Modern Web Development with Laravel 5.2 (PHP Framework),120,2142,536,12.0,25.023342670401494
Programming for Entrepreneurs - JavaScript,200,12873,106,2.5,0.8234288821564515
Create a Website from Scratch using HTML CSS step by step,75,12882,95,1.5,0.7374631268436578
Complete AJAX Course: Learn AJAX Techniques Using Bootstrap,195,12368,89,3.5,0.7195989650711513
Learn jQuery by Example Course,170,8625,94,5.0,1.0898550724637681
Bootstrap 4 Theme Development Masterclass,150,2641,28,39.0,1.0602044680045437
Wordpress Theme Development for Beginners,20,1052,14,8.0,1.3307984790874523
Web Design Creating websites from scratch,75,13920,64,2.0,0.45977011494252873
HTML Learning the Basics Intro to HTML website coding,20,7416,65,39.0,0.8764832793959008
Learn how to use Javascript Components with PHP and Symfony,90,1822,4,2.0,0.21953896816684962
So you think you know JavaScript?,50,1010,154,6.0,15.247524752475247
Learn Node.js by building Udemy: Stripe + MailChimp + Wistia,110,1425,36,5.5,2.526315789473684
Learn jQuery: An In-depth Course For Beginners,50,7014,95,4.5,1.354433989164528
JavaScript for Beginning Web Developers,75,7785,416,4.5,5.3436095054592165
JQuery Create Overlay Popups from scratch using Jquery,50,4407,17,2.5,0.3857499432720672
Vue JS 2: From Beginner to Professional,145,602,93,15.5,15.448504983388705
Ultimate AngularJS: Build a Real-World App from Scratch,100,1712,438,5.5,25.58411214953271
Wordpress Site Migration,20,1894,40,1.5,2.1119324181626187
introduction to HTML Course,20,3258,32,2.0,0.9821976672805401
Create Single Page Website using Twitter Bootstrap 3,20,7449,111,1.0,1.4901329037454691
The All-In-One Web Development Course,85,538,13,18.5,2.41635687732342
Code a Responsive Website Using HTML5 and CSS for Beginners,50,1271,136,7.5,10.700236034618412
AngularJS for the Real World - Learn by creating a WebApp,115,1407,137,7.0,9.737029140014215
Wordpress Tutorial   ,200,2311,8,1.5,0.34617048896581565
Create a REAL Social Network like Facebook in PHP + MySQL,45,1002,178,16.5,17.764471057884233
Advanced Node.js Development,55,2565,32,3.0,1.2475633528265107
ASP.NET MVC 5 Project - Facebook Clone,30,210,19,5.0,9.047619047619047
Bootstrap For Beginners: A  Basic Introduction,55,1186,14,40.0,1.1804384485666104
jQuery for Beginners,20,1421,17,4.0,1.1963406052076002
JavaScript Basics For Web Developers,20,958,14,1.0,1.4613778705636742
Learn PHP from Scratch,50,1550,25,1.5,1.6129032258064515
Learn Express,25,1309,60,1.5,4.583651642475172
"Build A Web App with VueJS, Spring Framework and MongoDB",145,251,32,3.5,12.749003984063744
Zend Framework 2: Learn the PHP framework ZF2 from scratch,40,723,130,6.5,17.98063623789765
Improved SEO with Rich Snippets and MicroData,Free,11026,228,1.0,2.0678396517322692
X theme for WordPress: Responsive web design without code!,20,1318,81,7.0,6.145675265553869
Become a HTML and CSS Developer - Build a Responsive Site,Free,3894,91,2.0,2.336928608115049
How to Make a Wordpress Website 2017,Free,12293,235,3.0,1.9116570405922069
Install Wordpress,20,1447,35,40.0,2.4187975120939877
CSS Specialist: Comprehensive CSS Training,100,487,31,6.0,6.365503080082135
Introduction to Laravel 4,Free,9110,411,2.5,4.511525795828759
Introduction to Elm,Free,1519,28,1.0,1.8433179723502304
Learn to Freelance with People Per hour  (URDU),20,948,48,36.0,5.063291139240507
Learn Wordpress 4 from Scratch : Create Awesome Websites,75,2023,8,2.0,0.3954522985664854
